{
  "schema_version": 1,
  "goals": [
    {
      "id": "goal:engineering-review",
      "text": "Identify evidence-backed engineering risks and remediation tradeoffs.",
      "priority": "high"
    }
  ],
  "constraints": [],
  "risk_posture": {
    "change_tolerance": "moderate",
    "operational_criticality": "moderate",
    "security_sensitivity": "moderate"
  },
  "documents": [],
  "excluded_domains": [],
  "budgets": {
    "max_context_bytes": null,
    "max_document_bytes": null,
    "max_document_total_bytes": null,
    "max_lookup_requests": null,
    "max_lookup_hops": null
  }
}
